market_id,question,yes_prob,volume,liquidity,affects_pharma_supply,source_countries,disruption_level,reasoning,evaluated_at
2308679,Spread: Cleveland Guardians (-1.5),0.405,977.356665,60495.4375,FALSE,,NO DISRUPTION,"The MLB game between the Cleveland Guardians and Detroit Tigers is an unrelated sports event with no implications for pharmaceutical manufacturing, sourcing, or logistics.",2026-05-20T15:26:16Z
1395171,Will Shohei Ohtani win the 2026 NL Cy Young Award?,0.1815,9773.094197,3660.02678,FALSE,,NO DISRUPTION,"The 2026 NL Cy Young Award is a sports event unrelated to pharmaceutical manufacturing, raw material sourcing, or logistics.",2026-05-20T15:26:21Z
1280324,Will any OpenAI GPT model score at least 70% on the FrontierMath Exam?,0.231,9771.551651999998,1176.91716,FALSE,,NO DISRUPTION,"FrontierMath Exam performance by OpenAI GPT models is unrelated to pharmaceutical supply chain operations, manufacturing, sourcing, or logistics.",2026-05-20T15:26:26Z
1284791,Will the Republican Party win the TN-08 House seat?,0.84,9769.217656,10334.0427,FALSE,,NO DISRUPTION,"The 2026 U.S. House election in TN-08 is an internal political contest with no direct implications for global pharmaceutical manufacturing, sourcing, or export controls.",2026-05-20T15:26:33Z
2308142,Spread: Thunder (-14.5),0.255,9769.179873000008,10665.8125,FALSE,,NO DISRUPTION,"The NBA game between the Thunder and Spurs is unrelated to pharmaceutical manufacturing, raw material sourcing, or logistics, with no pharma supply chain implications.",2026-05-20T15:26:38Z
2308142,Spread: Thunder (-14.5),0.255,9769.179873000008,10665.8125,FALSE,,NO DISRUPTION,"The NBA game between the Thunder and Spurs is a sports event unrelated to pharmaceutical manufacturing, raw material sourcing, or logistics.",2026-05-20T15:32:27Z
2248700,Palermo FC vs. US Catanzaro 1929: Draw at halftime?,0.39,97.680242,3562.8357,FALSE,,NO DISRUPTION,"The Palermo FC vs. US Catanzaro 1929 football match is a sports event in Italy with no direct or indirect implications for pharmaceutical manufacturing, raw material sourcing, or logistics.",2026-05-20T15:26:44Z
2071561,Will DR Congo reach the 2026 FIFA World Cup final?,0.0085,97.66,248.15065,FALSE,,NO DISRUPTION,"The 2026 FIFA World Cup final involving DR Congo is a sports event unrelated to pharmaceutical manufacturing, sourcing, or logistics in key pharma-producing/exporting nations.",2026-05-20T15:26:51Z
2263292,LoL: TLN Pirates vs Karmine Corp Blue - Game 1 Winner,0.465,9765.3044,23530.5995,FALSE,,NO DISRUPTION,"The LoL LFL Playoffs match between TLN Pirates and Karmine Corp Blue is an esports event unrelated to pharmaceutical manufacturing, sourcing, or logistics.",2026-05-20T15:26:58Z
1862940,Will Galatasaray SK win on 2026-05-01?,0.495,97.650212,0.4086,FALSE,,NO DISRUPTION,"The Galatasaray SK football match is a sports event unrelated to pharmaceutical manufacturing, raw material sourcing, or logistics in key pharma-producing/exporting nations.",2026-05-20T15:27:03Z
2289645,Will the highest temperature in New York City be between 98-99°F on May 20?,0.0055,976.4990480000002,1244.65411,FALSE,,NO DISRUPTION,"Extreme heat in New York City (98-99°F) is unrelated to pharmaceutical supply chain operations, manufacturing, or export controls in key pharma-sourcing nations.",2026-05-20T15:27:09Z
1284339,Will the Democratic Party win the NY-21 House seat?,0.315,9764.389376,4254.3085,FALSE,,NO DISRUPTION,"The NY-21 House seat election is a domestic U.S. political contest with no direct impact on global pharmaceutical manufacturing, sourcing, or export controls.",2026-05-20T15:27:15Z
1395181,Will Eury Perez win the 2026 NL Cy Young Award?,0.001,976.341,1625.83141,FALSE,,NO DISRUPTION,"The 2026 NL Cy Young Award is a sports event unrelated to pharmaceutical manufacturing, raw material sourcing, or logistics.",2026-05-20T15:27:20Z
635009,Will Shelley Hughes win the 2026 Alaska governor election?,0.0025,9761.042918000005,7119.32264,FALSE,,NO DISRUPTION,"Alaska's gubernatorial election is unrelated to pharmaceutical manufacturing, raw material sourcing, or global API/generics trade flows.",2026-05-20T15:27:26Z
1132823,Will Argentina’s annual inflation in 2026 be between 30% and 34.9%?,0.2935,975.999121,1320.33667,TRUE,Argentina; China; India; USA; Germany; Brazil; South Korea,SMALL DISRUPTION,"High inflation in Argentina would weaken local currency (ARS), increasing import costs for pharma inputs (e.g., APIs, excipients) from key suppliers, while also reducing purchasing power for multinational pharma firms operating there, but without triggering major trade barriers or capacity losses in primary manufacturing hubs.",2026-05-20T15:27:33Z
2099527,Will MrBeast hit 123.5 billion views by May 31?,0.997,9758.129096,4487.93926,FALSE,,NO DISRUPTION,"MrBeast's YouTube view milestone is an entertainment/sports-related event with no direct or indirect implications for pharmaceutical manufacturing, raw material sourcing, or logistics.",2026-05-20T15:27:38Z
1972628,Will the Bank of Korea decrease the base rate after the July Meeting?,0.045,9754.589994999998,2120.85365,FALSE,,NO DISRUPTION,"Bank of Korea's monetary policy adjustments (e.g., base rate changes) are macroeconomic measures unrelated to pharmaceutical manufacturing, sourcing, or logistics in key pharma nations.",2026-05-20T15:27:44Z
701861,"Will Pump.fun reach $0.0058 by December 31, 2026?",0.165,975.38545,1966.9236,FALSE,,NO DISRUPTION,"Pump.fun is a cryptocurrency project with no direct or indirect ties to pharmaceutical manufacturing, raw material sourcing, or logistics infrastructure.",2026-05-20T15:27:50Z
2277905,"Will the price of Bitcoin be between $78,000 and $80,000 on May 23?",0.27,975.206633,16614.7956,FALSE,,NO DISRUPTION,"Bitcoin price fluctuations are unrelated to pharmaceutical supply chain dynamics, manufacturing, sourcing, or export controls.",2026-05-20T15:27:55Z
949816,Will Joe Flacco start Week 1 for the Chiefs in 2026?,0.418,97.51788,50.20984,FALSE,,NO DISRUPTION,"The NFL Week 1 quarterback decision for the Kansas City Chiefs is an unrelated sports event with no implications for pharmaceutical manufacturing, sourcing, or logistics.",2026-05-20T15:28:01Z
2304478,OpenAI vs Meta — higher valuation on December 31?,0.28,97.505191,5263.6692,FALSE,,NO DISRUPTION,"The valuation competition between OpenAI and Meta is unrelated to pharmaceutical manufacturing, raw material sourcing, or logistics, with no direct impact on API/generics supply chains.",2026-05-20T15:28:06Z
2132802,"Will Ethereum dip to $1,400 in May?",0.007,97497.56128599988,113856.28529,FALSE,,NO DISRUPTION,"Ethereum price fluctuations are unrelated to pharmaceutical supply chain dynamics, manufacturing, sourcing, or export controls.",2026-05-20T15:28:11Z
969726,Will Tracie Burke be the Democratic nominee for Senate in Louisiana?,0.0055,9748.619824000005,3841.29627,FALSE,,NO DISRUPTION,"The Louisiana Democratic Senate Primary is an internal U.S. political election with no direct impact on global pharmaceutical manufacturing, sourcing, or export controls.",2026-05-20T15:28:16Z
2309466,Will the highest temperature in Denver be between 36-37°F on May 22?,0.003,974.772,8497.99509,FALSE,,NO DISRUPTION,"Weather conditions in Denver (e.g., temperature fluctuations) are unrelated to pharmaceutical supply chain disruptions, manufacturing, sourcing, or logistics of APIs, raw materials, or finished drugs.",2026-05-20T15:28:22Z
2299030,Will Kraken's valuation hit (HIGH) $11.5B by June 30?,0.435,974.668325,1292.4746,FALSE,,NO DISRUPTION,"Kraken's valuation as a cryptocurrency exchange platform is unrelated to pharmaceutical supply chain manufacturing, raw material sourcing, or logistics.",2026-05-20T15:28:27Z
1993185,"Will ""EL SER QUERIDO by Rodrigo SOROGOYEN (THE BELOVED)"" win Palme d'Or at the 2026 Cannes Film Festival?",0.015,974.594255,2961.7469,FALSE,,NO DISRUPTION,"The Cannes Film Festival is an entertainment event unrelated to pharmaceutical manufacturing, sourcing, or logistics.",2026-05-20T15:28:33Z
2037295,Will Yordan Alvarez lead the MLB in runs for the 2026 regular season?,0.0195,97.45,2943.2648,FALSE,,NO DISRUPTION,"MLB player performance (e.g., Yordan Alvarez leading in runs) is unrelated to pharmaceutical manufacturing, raw material sourcing, or global supply chain logistics.",2026-05-20T15:28:38Z
1283752,Will the Republican Party win the MD-06 House seat?,0.12,9743.608350000002,10498.6848,FALSE,,NO DISRUPTION,"The 2026 U.S. House election in Maryland's 6th district (MD-06) is an internal political contest with no direct implications for global pharmaceutical manufacturing, raw material sourcing, or export controls.",2026-05-20T15:28:44Z
2294293,Will Beau Hossler win the 2026 THE CJ CUP Byron Nelson?,0.0095,9.74,4086.78334,FALSE,,NO DISRUPTION,"The 2026 THE CJ CUP Byron Nelson is a golf tournament held in the USA, with no direct or indirect implications for pharmaceutical manufacturing, raw material sourcing, or global supply chains.",2026-05-20T15:28:50Z
2294286,Will Ze-Cheng Dou win the 2026 THE CJ CUP Byron Nelson?,0.0085,9.74,9056.30508,FALSE,,NO DISRUPTION,"The 2026 THE CJ CUP Byron Nelson is a golf tournament held in the USA, with no direct or indirect implications for pharmaceutical manufacturing, raw material sourcing, or global supply chains.",2026-05-20T15:28:55Z
1972786,Will Chet Holmgren win the 2026 NBA Finals MVP?,0.014,973.874241,8946.37809,FALSE,,NO DISRUPTION,"The 2026 NBA Finals MVP award is an entertainment/sports event unrelated to pharmaceutical manufacturing, sourcing, or logistics.",2026-05-20T15:29:01Z
2167615,Will LaBaron Philon be the 3rd overall pick in the 2026 NBA Draft?,0.0275,97.38,968.66526,FALSE,,NO DISRUPTION,"The 2026 NBA Draft selection of LaBaron Phon is an unrelated sports event with no direct or indirect impact on pharmaceutical supply chains, manufacturing, or trade.",2026-05-20T15:29:06Z
2256143,Will Spencer Pratt finish first in the first round of the 2026 Los Angeles mayoral election?,0.205,9737.24149,14047.6631,FALSE,,NO DISRUPTION,"The 2026 Los Angeles mayoral election is unrelated to pharmaceutical supply chains, manufacturing, sourcing, or export controls in key pharma-producing nations.",2026-05-20T15:29:12Z
2055071,Will Jordan Bardella announce their candidacy for the 2027 French presidential election in 2026?,0.665,973.4587679999996,390.6336,FALSE,,NO DISRUPTION,Jordan Bardella's potential candidacy for the 2027 French presidential election is a domestic political event unrelated to pharmaceutical supply chain operations or trade in key pharma-manufacturing/export nations.,2026-05-20T15:29:17Z
2284822,World Championships: Austria vs. Germany,0.5,97.3,4,FALSE,,NO DISRUPTION,"The Austria vs. Germany World Championship match is a sports event unrelated to pharmaceutical manufacturing, sourcing, or logistics in key pharma-producing nations.",2026-05-20T15:29:23Z
2256681,Will Marvell Q1 Data Center revenue be above $1.85B?,0.38,972.98,3058.6,FALSE,,NO DISRUPTION,"Marvell's data center revenue performance is unrelated to pharmaceutical supply chain inputs, manufacturing, or logistics.",2026-05-20T15:29:29Z
2074140,"Will Airbnb, Inc. (ABNB) hit (LOW) $120 in May?",0.0605,9729.693677000005,1388.63972,FALSE,,NO DISRUPTION,"Airbnb's stock price volatility is unrelated to pharmaceutical supply chain dynamics, manufacturing, raw material sourcing, or export controls.",2026-05-20T15:29:34Z
2118773,Will three people dissent the June Fed decision?,0.025,972.941056,12054.95678,FALSE,,NO DISRUPTION,"FOMC dissent votes on monetary policy (e.g., Fed Funds Rate) are internal institutional decisions unrelated to pharmaceutical supply chain operations, trade, or manufacturing.",2026-05-20T15:29:40Z
687276,Will Yang Seung-jo win the 2026 Chungcheongnam Province gubernatorial election?,0.003,97287.047983,17757.60965,FALSE,,NO DISRUPTION,"The 2026 Chungcheongnam Province gubernatorial election in South Korea is a local political event with no direct impact on global pharmaceutical manufacturing, sourcing, or trade.",2026-05-20T15:29:46Z
921661,"Tshisekedi out as President of the DRC by December 31, 2026?",0.085,9726.214008000035,12739.0884,TRUE,China; India; Germany; Switzerland; Ireland; Italy; France; Belgium; Netherlands,SMALL DISRUPTION,"DRC’s political transition could trigger localized instability affecting key African raw material hubs (e.g., cobalt/lithium for APIs) and minor trade disruptions in European/Asian pharma supply chains via regulatory delays or port congestion.",2026-05-20T15:29:53Z
2260362,Chicago White Sox vs. Seattle Mariners,0.425,97255.049946,279785.6662,FALSE,,NO DISRUPTION,"The MLB game between the Chicago White Sox and Seattle Mariners is an unrelated sports event with no implications for pharmaceutical manufacturing, sourcing, or logistics.",2026-05-20T15:29:59Z
1284258,Will the Republican Party win the NY-08 House seat?,0.075,9719.230514,13365.3617,FALSE,,NO DISRUPTION,"The NY-08 House seat election is a domestic U.S. political contest with no direct implications for global pharmaceutical manufacturing, sourcing, or export controls.",2026-05-20T15:30:04Z
2075426,Will Moana Pasifika win?,0.105,97.16,1456.6992,FALSE,,NO DISRUPTION,"The Moana Pasifika rugby game is a sports event unrelated to pharmaceutical manufacturing, raw material sourcing, or logistics in key pharma-producing nations.",2026-05-20T15:30:10Z
2200570,Exact Score: Chongqing Tonglianglong FC 1 - 3 Yunnan Yukun FC?,5e-4,9.7154,3199.02403,FALSE,,NO DISRUPTION,"The Chinese Super League football match between Chongqing Tonglianglong FC and Yunnan Yukun FC is unrelated to pharmaceutical supply chain activities, manufacturing, or trade.",2026-05-20T15:30:15Z
1439549,Fed rate cut by September 2026 meeting?,0.1335,97150.97660299984,16447.30591,FALSE,,NO DISRUPTION,"A Federal Reserve rate cut is a monetary policy decision unrelated to pharmaceutical manufacturing, raw material sourcing, or export controls.",2026-05-20T15:30:21Z
1283648,Will the Republican Party win the MA-02 House seat?,0.065,9712.6634,16802.7286,FALSE,,NO DISRUPTION,"The MA-02 House seat election in Massachusetts is a domestic U.S. political contest with no direct implications for global pharmaceutical manufacturing, raw material sourcing, or export controls.",2026-05-20T15:30:26Z
2069872,Will CSyD Macará vs. Club Alianza Atlético end in a draw?,0.205,97.118635,73026.7989,FALSE,,NO DISRUPTION,"The football match between CSyD Macará and Club Alianza Atlético is a local sporting event in Ecuador with no direct or indirect implications for pharmaceutical manufacturing, raw material sourcing, or global supply chains.",2026-05-20T15:30:32Z
1897444,Will Algeria vs. Austria end in a draw?,0.26,9.711537,6101.3296,FALSE,,NO DISRUPTION,"The Algeria vs. Austria football match is a sports event unrelated to pharmaceutical manufacturing, sourcing, or logistics in key pharma-producing/exporting nations.",2026-05-20T15:30:38Z
2242048,Will monthly inflation increase by 0.4% in May?,0.06,971.1245650000002,5619.9836,FALSE,,NO DISRUPTION,"Inflation data (CPI-U) is an economic indicator unrelated to direct pharmaceutical supply chain disruptions, manufacturing, sourcing, or export controls.",2026-05-20T15:30:43Z
629583,Will the Democrats win the Oregon governor race in 2026?,0.87,9710.944324,12421.9487,FALSE,,NO DISRUPTION,The 2026 Oregon gubernatorial election is a state-level election in a non-pharma-manufacturing or export hub with no direct implications for global API/generics supply chains.,2026-05-20T15:30:49Z
582134,Will Liverpool finish in the top 4 of the EPL 2025–26 standings?,0.525,97101.52901300004,12870.5047,FALSE,,NO DISRUPTION,"The 2025–26 English Premier League season is a sports event unrelated to pharmaceutical manufacturing, raw material sourcing, or global trade flows.",2026-05-20T15:30:55Z
676788,Anysphere (Cursor) IPO before 2027?,0.0485,97090.4076900001,3742.84807,FALSE,,NO DISRUPTION,"Anysphere (Cursor) is a data infrastructure company specializing in AI-driven analytics and cloud solutions, with no direct involvement in pharmaceutical manufacturing, API production, or raw material sourcing.",2026-05-20T15:31:01Z
2244947,Arc FDV above $500M one day after launch?,0.93,97.042558,3309.7385,FALSE,,NO DISRUPTION,"Arc's governance token launch is unrelated to pharmaceutical supply chain operations, manufacturing, or trade in APIs/generics.",2026-05-20T15:31:06Z
1367025,Will Hudson Williams be named People's Sexiest Man Alive in 2026?,0.09,97.032704,2187.9705,FALSE,,NO DISRUPTION,"Hudson Williams' recognition as *People* magazine's Sexiest Man Alive is an entertainment/media event unrelated to pharmaceutical manufacturing, sourcing, or logistics.",2026-05-20T15:31:12Z
2271689,Will Alphabet Inc. (GOOGL) hit (LOW) $375 Week of May 18 2026?,0.27,970,352.8391,FALSE,,NO DISRUPTION,"Alphabet Inc. (GOOGL) is a technology company with no direct involvement in pharmaceutical manufacturing, raw material sourcing, or logistics, rendering its stock price irrelevant to global API/generics supply chains.",2026-05-20T15:31:18Z
2134636,Will Bulls win the 2026 United Rugby Championship Grand Final?,0.36,97,150.06,FALSE,,NO DISRUPTION,"The 2026 United Rugby Championship Grand Final is a sports event unrelated to pharmaceutical manufacturing, raw material sourcing, or logistics.",2026-05-20T15:31:24Z
2271795,Will NVIDIA (NVDA) hit (HIGH) $244 Week of May 18 2026?,0.27,969.998885,6454.9599,FALSE,,NO DISRUPTION,"NVIDIA's stock price movement is unrelated to pharmaceutical supply chain dynamics, manufacturing, raw material sourcing, or export controls.",2026-05-20T15:31:29Z
700395,Will Lovable be acquired before 2027?,0.135,969500.6627129996,3368.3357,FALSE,,NO DISRUPTION,"Lovable operates primarily in the entertainment/tech sector (e.g., gaming, digital platforms), with no direct involvement in API manufacturing, raw material sourcing, or pharmaceutical logistics.",2026-05-20T15:31:36Z
1818374,Will Everton qualify for the League Phase of the 2026-27 UEFA Conference League?,0.017,96.95,78.10298,FALSE,,NO DISRUPTION,"Everton FC's qualification for the 2026-27 UEFA Conference League is a sports event unrelated to pharmaceutical manufacturing, raw material sourcing, or global supply chain dynamics.",2026-05-20T15:31:43Z
1897040,Will Canada win on 2026-06-12?,0.545,969.378142,12123.343,FALSE,,NO DISRUPTION,"The event is a sports match (Canada vs. another team) with no direct or indirect implications for pharmaceutical manufacturing, raw material sourcing, or global API/generics supply chains.",2026-05-20T15:31:50Z
1972794,Will Victor Wembanyama win the 2026 NBA Finals MVP?,0.38,9692.427673999997,18725.9608,FALSE,,NO DISRUPTION,"The 2026 NBA Finals MVP award is an entertainment/sports event unrelated to pharmaceutical manufacturing, sourcing, or logistics.",2026-05-20T15:31:57Z
2307825,Will Anthropic's valuation hit (HIGH) $5.0T by December 31?,0.055,969.236742,61091.0339,FALSE,,NO DISRUPTION,"Anthropic's valuation as a private AI company is unrelated to pharmaceutical manufacturing, raw material sourcing, or logistics infrastructure.",2026-05-20T15:32:04Z
2219510,Minnesota Lynx vs. Chicago Sky,0.435,96.9,268.0632,FALSE,,NO DISRUPTION,"The WNBA game between the Minnesota Lynx and Chicago Sky is a sports event unrelated to pharmaceutical manufacturing, raw material sourcing, or logistics.",2026-05-20T15:32:09Z
1402896,Les Wexner charged by June 30?,0.062,9688.074847000002,3852.2601,FALSE,,NO DISRUPTION,"Leslie Wexner's legal proceedings (e.g., LBRY/OnlyFans controversies) lack direct ties to pharmaceutical manufacturing, sourcing, or export controls in key API/generics hubs.",2026-05-20T15:32:16Z
2305331,Will Canva have the highest private market valuation on June 30?,0.0015,968.647,8340.10261,FALSE,,NO DISRUPTION,"Canva is a graphic design software company with no direct or indirect involvement in pharmaceutical manufacturing, raw material sourcing, or drug logistics.",2026-05-20T15:32:21Z
2308142,Spread: Thunder (-14.5),0.255,9683.762441000008,9952.6076,FALSE,,NO DISRUPTION,"The NBA game between the Thunder and Spurs is unrelated to pharmaceutical manufacturing, raw material sourcing, or logistics, with no pharma supply chain implications.",2026-05-20T15:26:38Z
2308142,Spread: Thunder (-14.5),0.255,9683.762441000008,9952.6076,FALSE,,NO DISRUPTION,"The NBA game between the Thunder and Spurs is a sports event unrelated to pharmaceutical manufacturing, raw material sourcing, or logistics.",2026-05-20T15:32:27Z
2289907,Will the highest temperature in Denver be between 46-47°F on May 20?,0.002,968.2619370000002,1445.68811,FALSE,,NO DISRUPTION,"Weather conditions in Denver (e.g., temperature fluctuations) are unrelated to pharmaceutical supply chain disruptions, manufacturing, sourcing, or export controls.",2026-05-20T15:32:33Z
2278130,"Will Trump say ""Comrade"" this week?",0.395,96.802445,61.4708,FALSE,,NO DISRUPTION,"The term 'Comrade' is politically charged and unlikely to be used by Donald Trump in a pharma-related context, and no known geopolitical or trade actions in major pharma-sourcing nations are imminent.",2026-05-20T15:32:39Z
2271782,Will NVIDIA (NVDA) finish week of May 18 above $215?,0.73,967.922141,10720.0399,FALSE,,NO DISRUPTION,"NVIDIA's stock performance is unrelated to pharmaceutical supply chain dynamics, manufacturing, raw material sourcing, or export controls.",2026-05-20T15:32:45Z
2074056,"Will Tesla, Inc. (TSLA) hit (LOW) $300 in May?",0.0235,9678.971418,8912.62524,FALSE,,NO DISRUPTION,"Tesla's stock price volatility is unrelated to pharmaceutical supply chain dynamics, manufacturing, raw material sourcing, or export controls.",2026-05-20T15:32:51Z
2309176,Will the highest temperature in Toronto be 15°C on May 22?,0.255,96.76857,837.6929,FALSE,,NO DISRUPTION,"Weather conditions in Toronto (e.g., temperature fluctuations) do not impact pharmaceutical supply chains, manufacturing, or global sourcing/export logistics.",2026-05-20T15:32:56Z
2297689,Irina-Camelia Begu vs. Suzan Lamens: Total Sets O/U 2.5,0.9995,96.702701,41157.34116,FALSE,,NO DISRUPTION,"The tennis match between Irina-Camelia Begu and Suzan Lamens is a sports event unrelated to pharmaceutical manufacturing, sourcing, or logistics.",2026-05-20T15:33:01Z
1087785,Will Beatriz Haddad Maia win the 2026 Women’s French Open?,0.0015,9667.489573000008,6711.46502,FALSE,,NO DISRUPTION,"The 2026 Women’s French Open tennis tournament is a sports event unrelated to pharmaceutical manufacturing, raw material sourcing, or logistics, with no direct impact on global API/generics supply chains.",2026-05-20T15:33:07Z
2134626,Will Leinster win the 2026 United Rugby Championship Grand Final?,0.405,96.66666,124.85,FALSE,,NO DISRUPTION,"The 2026 United Rugby Championship Grand Final is a sports event unrelated to pharmaceutical manufacturing, sourcing, or logistics.",2026-05-20T15:33:13Z
960224,Will Jack Ellison be the Republican Nominee for SC-01?,0.018,966.651516,3418.61193,FALSE,,NO DISRUPTION,"The 2026 U.S. House of Representatives primary for SC-01 is an internal political contest unrelated to pharmaceutical manufacturing, raw material sourcing, or global trade in APIs/generics.",2026-05-20T15:33:19Z
1090010,"Will Rafael Fiziev be the UFC Lightweight Champion on December 31, 2026?",0.0015,966.643,357.39811,FALSE,,NO DISRUPTION,"The UFC Lightweight Championship title change is a sports entertainment event unrelated to pharmaceutical manufacturing, raw material sourcing, or global trade logistics.",2026-05-20T15:33:25Z
692582,Will Ubisoft announce bankruptcy by June 30?,0.018,9661.151408000012,3412.15312,FALSE,,NO DISRUPTION,"Ubisoft is a video game publisher (entertainment industry), with no direct or indirect involvement in pharmaceutical manufacturing, raw material sourcing, or logistics.",2026-05-20T15:33:31Z
1068690,"Will Phantom launch a token by June 30, 2026?",0.019,9658.542599,1790.11326,FALSE,,NO DISRUPTION,"Phantom is a blockchain-based decentralized identity protocol with no direct ties to pharmaceutical manufacturing, raw material sourcing, or logistics infrastructure.",2026-05-20T15:33:36Z
1067181,"Will Citigroup fail by June 30, 2026?",0.0085,9657.885857,2581.40947,FALSE,,NO DISRUPTION,"Citigroup’s failure would primarily impact financial markets, lending, and capital flows—not pharma manufacturing, raw material sourcing, or logistics infrastructure.",2026-05-20T15:33:42Z
2289601,Will the highest temperature in Buenos Aires be 15°C on May 20?,0.55,965.5384890000004,141.3327,FALSE,,NO DISRUPTION,Weather conditions in Buenos Aires (Argentina) are unrelated to pharmaceutical supply chain operations in key API/pharma-manufacturing or exporting nations.,2026-05-20T15:33:47Z
2305186,"Will ""The Roast of Kevin Hart"" be the top global Netflix show this week?",0.035,96.551624,1388.5579,FALSE,,NO DISRUPTION,"The event is unrelated to pharmaceutical supply chains, as it pertains to entertainment (Netflix show rankings) and does not involve geopolitical, trade, or manufacturing disruptions in key pharma source nations.",2026-05-20T15:33:53Z
1283448,Will the Republican Party win the IN-02 House seat?,0.925,965.199555,13045.1807,FALSE,,NO DISRUPTION,"The 2026 IN-02 House seat election in the U.S. is unrelated to pharmaceutical manufacturing, raw material sourcing, or global API/generics trade flows.",2026-05-20T15:33:59Z
1486004,Decibel FDV above $200M one day after launch?,0.365,96.5,20.2022,FALSE,,NO DISRUPTION,"Decibel's governance token launch is unrelated to pharmaceutical supply chain operations, manufacturing, or trade in APIs/generics.",2026-05-20T15:34:04Z
1975424,Will DeepSeek have the third best AI model at the end of May 2026?,0.0015,9647.966500000006,7638.23954,FALSE,,NO DISRUPTION,"AI model rankings on Chatbot Arena are unrelated to pharmaceutical supply chain operations, manufacturing, or trade in APIs/generics.",2026-05-20T15:34:09Z
