market_id,question,yes_prob,volume,liquidity,affects_pharma_supply,source_countries,disruption_level,reasoning,evaluated_at
1500563,Will Mayes Middleton win the Texas Republican primary runoff for Attorney General?,0.67,964.7879119999998,43.7577,FALSE,,NO DISRUPTION,"The Texas Republican primary runoff for Attorney General is an internal U.S. political election with no direct implications for global pharmaceutical manufacturing, sourcing, or export controls.",2026-05-20T15:34:14Z
1833904,"Will ""Gachiakuta"" win Best New Series at the 2026 Crunchyroll Anime Awards?",0.57,964.473187,560.203,FALSE,,NO DISRUPTION,"The 2026 Crunchyroll Anime Awards ceremony is an entertainment event unrelated to pharmaceutical manufacturing, raw material sourcing, or logistics.",2026-05-20T15:34:20Z
664895,"Will MetaMask launch a token by September 30, 2026?",0.12,964361.9579390018,3270.2358,FALSE,,NO DISRUPTION,"MetaMask's potential token launch is unrelated to pharmaceutical supply chains, manufacturing, raw material sourcing, or export controls.",2026-05-20T15:34:25Z
2099134,Will Morgan Ensberg be the next Red Sox manager?,0.023,96.41,141.02663,FALSE,,NO DISRUPTION,"The appointment of a Boston Red Sox manager is unrelated to pharmaceutical supply chain dynamics, manufacturing, sourcing, or logistics.",2026-05-20T15:34:30Z
2300174,Will Neuralink's valuation hit (HIGH) $100B by December 31?,0.115,963.702856,7098.2292,FALSE,,NO DISRUPTION,"Neuralink's valuation surge is unrelated to pharmaceutical supply chain dynamics, manufacturing, or export controls in key pharma nations.",2026-05-20T15:34:35Z
2305340,Will Stripe have the highest private market valuation on June 30?,0.014,963.3396000000002,14968.51081,FALSE,,NO DISRUPTION,"Stripe's valuation as a private company is unrelated to pharmaceutical supply chain dynamics, manufacturing, sourcing, or logistics.",2026-05-20T15:34:41Z
628942,Will Stephen Cloobeck win the California Governor Election in 2026?,0.0015,963174.1223450004,173840.27873,FALSE,,NO DISRUPTION,"California gubernatorial elections are domestic political events with no direct impact on global pharmaceutical manufacturing, sourcing, or export controls.",2026-05-20T15:34:46Z
1119647,"New ""Stranger Things"" episode released by December 31? ",0.075,963080.504393002,51483.4073,FALSE,,NO DISRUPTION,"The release of a new *Stranger Things* episode is an entertainment industry event unrelated to pharmaceutical manufacturing, raw material sourcing, or logistics.",2026-05-20T15:34:51Z
1447964,Will Dallas Cowboys win the 2026 NFC East?,0.31,962.887646,2566.304,FALSE,,NO DISRUPTION,"The 2026 NFC East division championship is an NFL sports event unrelated to pharmaceutical manufacturing, raw material sourcing, or global trade logistics.",2026-05-20T15:34:57Z
2159042,"Will the median home value in the DC Metro area be between $553,000 and $559,000 on May 31?",0.17,96.24,32.6449,FALSE,,NO DISRUPTION,"The median home value in the DC Metro area is unrelated to pharmaceutical supply chain dynamics, manufacturing, sourcing, or export controls.",2026-05-20T15:35:02Z
2272107,"Will ""Potential - sombr"" be the #1 song on Spotify this week?",0.0095,962.285,1958.43238,FALSE,,NO DISRUPTION,"The event involves a music-related market (Spotify top song) with no connection to pharmaceutical manufacturing, raw material sourcing, or logistics.",2026-05-20T15:35:08Z
1833902,"Will ""Clevatess"" win Best New Series at the 2026 Crunchyroll Anime Awards?",0.015,962.182464,878.21968,FALSE,,NO DISRUPTION,"The 2026 Crunchyroll Anime Awards ceremony is an entertainment event unrelated to pharmaceutical manufacturing, raw material sourcing, or logistics.",2026-05-20T15:35:13Z
688127,Will the UK designate the IRGC a terrorist organization by June 30? ,0.0635,96214.67149499989,5815.39655,TRUE,Iran; China; India; Germany; Switzerland; Ireland; Italy; France; Belgium; Singapore; Netherlands; Israel; Canada; Australia,LARGE DISRUPTION,"IRGC-linked entities (e.g., Iranian state-owned pharma firms, Chinese/Indian suppliers with Iranian trade ties, or European/Asian firms operating in sanctioned regions) face severe trade restrictions, export bans on dual-use chemicals, or financial sanctions, disrupting API/generics supply chains for critical drug classes (e.g., antibiotics, oncology agents) with >5% global capacity at risk.",2026-05-20T15:35:23Z
2264831,Will South Korea ETF (EWY) hit (HIGH) $200 in May?,0.32,962.05,260.9265,FALSE,,NO DISRUPTION,"The South Korea ETF (EWY) price movement is unrelated to pharmaceutical supply chain dynamics, manufacturing, or export controls in key pharma nations.",2026-05-20T15:35:28Z
1126694,Will Cristiano Ronaldo announce his retirement in 2026?,0.13,9620.022586,106.947,FALSE,,NO DISRUPTION,"Cristiano Ronaldo's retirement from club soccer is unrelated to pharmaceutical supply chain operations, manufacturing, or trade dynamics.",2026-05-20T15:35:33Z
1744225,Will the Bank of Mexico announce no change at the June meeting?,0.9525,9618.851240999997,2168.78071,FALSE,,NO DISRUPTION,"Bank of Mexico's monetary policy decisions are macroeconomic in nature and do not directly impact pharmaceutical manufacturing, raw material sourcing, or logistics.",2026-05-20T15:35:39Z
1395165,Will Hunter Greene win the 2026 NL Cy Young Award?,0.0015,961.812833,1925.25006,FALSE,,NO DISRUPTION,"The 2026 NL Cy Young Award is a sports event unrelated to pharmaceutical manufacturing, raw material sourcing, or logistics.",2026-05-20T15:35:44Z
693578,Will Gen.G Esports win the LCK 2026 season playoffs?,0.37,96180.85343200012,2234.5277,FALSE,,NO DISRUPTION,"The League of Legends Champions Korea (LCK) 2026 playoffs are an esports event unrelated to pharmaceutical manufacturing, raw material sourcing, or logistics.",2026-05-20T15:35:49Z
2068348,Grêmio FBPA vs. CD Palestino: O/U 2.5,0.495,9.615383,15754.9996,FALSE,,NO DISRUPTION,"The Copa Sudamericana match between Grêmio FBPA (Brazil) and CD Palestino (Chile) is a sports event unrelated to pharmaceutical manufacturing, sourcing, or logistics in key pharma-producing/exporting nations.",2026-05-20T15:35:55Z
2067492,Spread: LDU de Quito (-1.5),0.24,9.615383,37664.3597,FALSE,,NO DISRUPTION,"The Copa Libertadores match between LDU de Quito and CA Lanús is a sports event unrelated to pharmaceutical manufacturing, sourcing, or logistics in key pharma-producing/exporting nations.",2026-05-20T15:36:01Z
2307351,Set Handicap: Faria (-1.5) vs Smith (+1.5),5e-4,9.615383,10476.13813,FALSE,,NO DISRUPTION,"The tennis match between Jaime Faria and Colton Smith at Roland Garros is an unrelated sports event with no implications for pharmaceutical manufacturing, sourcing, or logistics.",2026-05-20T15:36:06Z
562188,Will Dawn Buckingham win the 2026 Texas Republican Primary?,5e-4,961333.4454319988,24166.72786,FALSE,,NO DISRUPTION,"The 2026 Texas Republican Senate Primary is an internal U.S. political election with no direct implications for global pharmaceutical manufacturing, sourcing, or export controls.",2026-05-20T15:36:11Z
1222010,Will Zendaya and Tom Holland get married by December 31?,0.7245,9611.397629000005,381.03529,FALSE,,NO DISRUPTION,"Zendaya and Tom Holland's marriage is an entertainment industry event unrelated to pharmaceutical manufacturing, raw material sourcing, or logistics.",2026-05-20T15:36:17Z
2309261,Will the highest temperature in Wellington be 11°C on May 22?,0.0055,96.1053,1632.60144,FALSE,,NO DISRUPTION,"The highest temperature in Wellington on May 22, 2026, is unrelated to pharmaceutical supply chain operations, manufacturing, sourcing, or logistics.",2026-05-20T15:36:22Z
2238558,Will Real Sociedad de Fútbol win on 2026-05-23?,0.325,9610.090155999997,532270.9889,FALSE,,NO DISRUPTION,"The Real Sociedad de Fútbol match is a sports event unrelated to pharmaceutical manufacturing, raw material sourcing, or logistics in key pharma-producing/exporting nations.",2026-05-20T15:36:28Z
2109524,"Will Meta have a #1 AI model by December 31, 2026?",0.155,961,3511.561,FALSE,,NO DISRUPTION,"Meta achieving a #1 AI model ranking on Chatbot Arena is unrelated to pharmaceutical supply chain dynamics, manufacturing, sourcing, or logistics.",2026-05-20T15:36:34Z
2252995,Will Rayo Vallecano de Madrid win on 2026-05-27?,0.235,960.876568,5119.62,FALSE,,NO DISRUPTION,"The soccer match between Rayo Vallecano de Madrid and an opponent is a sports event unrelated to pharmaceutical manufacturing, raw material sourcing, or logistics in key pharma-producing nations.",2026-05-20T15:36:39Z
2108046,"Will Donald Trump dance on May 22, 2026?",0.25,9.60526,340.5417,FALSE,,NO DISRUPTION,"Donald Trump's public appearances or activities are typically entertainment/election-related and lack direct ties to pharmaceutical manufacturing, sourcing, or logistics in key pharma nations.",2026-05-20T15:36:45Z
628951,Will Michael Younger win the California Governor Election in 2026?,0.0015,960364.012996004,185940.44876,FALSE,,NO DISRUPTION,"California gubernatorial elections are domestic political events with no direct impact on global pharmaceutical manufacturing, sourcing, or export controls.",2026-05-20T15:36:50Z
2132786,"Will Bitcoin dip to $35,000 in May?",0.0015,960313.9221200012,116356.22849,FALSE,,NO DISRUPTION,"Bitcoin price fluctuations are unrelated to pharmaceutical supply chain dynamics, manufacturing, raw material sourcing, or export controls.",2026-05-20T15:36:55Z
2261261,Will the price of Solana be above $70 on May 21?,0.9975,960.09857,14781.08454,FALSE,,NO DISRUPTION,"Solana (SOL) is a cryptocurrency unrelated to pharmaceutical supply chains, manufacturing, raw material sourcing, or logistics.",2026-05-20T15:37:00Z
1284551,Will the Republican Party win the OR-06 House seat?,0.0355,9599.429999999997,10615.25409,FALSE,,NO DISRUPTION,"The 2026 OR-06 House seat election in Oregon is unrelated to pharmaceutical manufacturing, raw material sourcing, or global supply chain dynamics.",2026-05-20T15:37:05Z
1321903,Will Trump repeal Presidential term limits in 2026?,0.058,9599.144309000005,17493.95634,FALSE,,NO DISRUPTION,"A U.S. presidential term limit repeal would primarily be a domestic political/electoral issue with no direct or indirect impact on global pharmaceutical supply chains, manufacturing, or trade flows.",2026-05-20T15:37:11Z
1794953,Will AC Milan place 2nd for the 2025-26 Serie A season?,0.044,959.901691,66.04856,FALSE,,NO DISRUPTION,AC Milan's 2025-26 Serie A season performance is unrelated to pharmaceutical supply chain dynamics or geopolitical/economic factors affecting key pharma-manufacturing or exporting nations.,2026-05-20T15:37:17Z
1607635,Will Real Salt Lake win on 2026-04-12?,0.2715,959.69918500000006,101.77812,FALSE,,NO DISRUPTION,"The Real Salt Lake soccer game is a sports event unrelated to pharmaceutical manufacturing, raw material sourcing, or logistics in key pharma-producing nations.",2026-05-20T15:37:22Z
1298648,OpenAI IPO closing market cap above $800B?,0.68,95968.68133500023,3019.7241,FALSE,,NO DISRUPTION,"OpenAI's IPO is unrelated to pharmaceutical manufacturing, raw material sourcing, or logistics, with no direct impact on API/generics supply chains or export controls.",2026-05-20T15:37:28Z
1362380,Obras vs. San Lorenzo,0.54,9596.600224999998,72,FALSE,,NO DISRUPTION,"The LNB basketball game between Obras and San Lorenzo is a sports event in Argentina, unrelated to pharmaceutical manufacturing, sourcing, or logistics.",2026-05-20T15:37:33Z
635003,Will Click Bishop win the 2026 Alaska governor election?,0.0505,9596.170310999998,13806.35617,FALSE,,NO DISRUPTION,"The 2026 Alaska gubernatorial election is unrelated to pharmaceutical manufacturing, raw material sourcing, or global supply chain logistics.",2026-05-20T15:37:38Z
1294070,Hurupay FDV above $30M one day after launch?,0.0345,9595.079855000004,4826.35101,FALSE,,NO DISRUPTION,"Hurupay's governance token launch is unrelated to pharmaceutical supply chain operations, manufacturing, or trade of APIs/generics.",2026-05-20T15:37:43Z
2271916,Will Opendoor Technologies Inc. (OPEN) hit (HIGH) $6.00 Week of May 18 2026?,0.011,959.374783,2238.37284,FALSE,,NO DISRUPTION,"Opendoor Technologies Inc. (OPEN) operates in the real estate tech sector, with no direct or indirect involvement in pharmaceutical manufacturing, raw material sourcing, or logistics.",2026-05-20T15:37:48Z
2192104,Will SC Freiburg win on 2026-05-20?,0.165,95906.39399499986,669818.0806,FALSE,,NO DISRUPTION,"SC Freiburg's football match is a sports event unrelated to pharmaceutical manufacturing, sourcing, or logistics in key pharma-producing/exporting nations.",2026-05-20T15:37:54Z
811725,Will the Green Party (MP) win the most seats in the 2026 Swedish parliamentary election?,0.0025,95901.50628100002,11920.31974,FALSE,,NO DISRUPTION,"Swedish parliamentary elections are domestic political events with no direct impact on global pharmaceutical manufacturing, sourcing, or export controls.",2026-05-20T15:37:59Z
